{
  "$schema": "./vehicle-definition.schema.json",
  "version": "2.0.0",
  "coordinateSystem": {
    "origin": "center-of-mass",
    "longitudinalAxis": "+x-forward",
    "lateralAxis": "+y-left",
    "angleDirection": "counterclockwise"
  },
  "dimensions": {
    "lengthMeters": 5.6,
    "widthMeters": 2,
    "wheelbaseMeters": 3.248,
    "frontAxleX": 1.512,
    "rearAxleX": -1.736
  },
  "massProperties": {
    "massKg": 770,
    "yawInertiaKgM2": 1450
  },
  "collisionShapes": [
    {
      "id": "front-wing-centre",
      "material": "front-wing",
      "vertices": [
        {
          "x": 2.212,
          "y": -0.11
        },
        {
          "x": 2.772,
          "y": -0.07
        },
        {
          "x": 2.772,
          "y": 0.07
        },
        {
          "x": 2.212,
          "y": 0.11
        }
      ]
    },
    {
      "id": "front-wing-left-1",
      "material": "front-wing",
      "vertices": [
        {
          "x": 2.5872,
          "y": 0.07
        },
        {
          "x": 2.352,
          "y": 0.38
        },
        {
          "x": 2.212,
          "y": 0.11
        }
      ]
    },
    {
      "id": "front-wing-left-2",
      "material": "front-wing",
      "vertices": [
        {
          "x": 2.5872,
          "y": 0.07
        },
        {
          "x": 2.436,
          "y": 0.94
        },
        {
          "x": 2.352,
          "y": 0.38
        }
      ]
    },
    {
      "id": "front-wing-left-3",
      "material": "front-wing",
      "vertices": [
        {
          "x": 2.5872,
          "y": 0.07
        },
        {
          "x": 2.716,
          "y": 1
        },
        {
          "x": 2.436,
          "y": 0.94
        }
      ]
    },
    {
      "id": "front-wing-left-4",
      "material": "front-wing",
      "vertices": [
        {
          "x": 2.5872,
          "y": 0.07
        },
        {
          "x": 2.772,
          "y": 0.96
        },
        {
          "x": 2.716,
          "y": 1
        }
      ]
    },
    {
      "id": "front-wing-right-1",
      "material": "front-wing",
      "vertices": [
        {
          "x": 2.212,
          "y": -0.11
        },
        {
          "x": 2.352,
          "y": -0.38
        },
        {
          "x": 2.5872,
          "y": -0.07
        }
      ]
    },
    {
      "id": "front-wing-right-2",
      "material": "front-wing",
      "vertices": [
        {
          "x": 2.352,
          "y": -0.38
        },
        {
          "x": 2.436,
          "y": -0.94
        },
        {
          "x": 2.5872,
          "y": -0.07
        }
      ]
    },
    {
      "id": "front-wing-right-3",
      "material": "front-wing",
      "vertices": [
        {
          "x": 2.436,
          "y": -0.94
        },
        {
          "x": 2.716,
          "y": -1
        },
        {
          "x": 2.5872,
          "y": -0.07
        }
      ]
    },
    {
      "id": "front-wing-right-4",
      "material": "front-wing",
      "vertices": [
        {
          "x": 2.716,
          "y": -1
        },
        {
          "x": 2.772,
          "y": -0.96
        },
        {
          "x": 2.5872,
          "y": -0.07
        }
      ]
    },
    {
      "id": "front-wing-left-endplate",
      "material": "front-wing",
      "vertices": [
        {
          "x": 2.268,
          "y": 0.94
        },
        {
          "x": 2.7832,
          "y": 0.94
        },
        {
          "x": 2.7832,
          "y": 0.988
        },
        {
          "x": 2.268,
          "y": 0.988
        }
      ]
    },
    {
      "id": "front-wing-right-endplate",
      "material": "front-wing",
      "vertices": [
        {
          "x": 2.268,
          "y": -0.988
        },
        {
          "x": 2.7832,
          "y": -0.988
        },
        {
          "x": 2.7832,
          "y": -0.94
        },
        {
          "x": 2.268,
          "y": -0.94
        }
      ]
    },
    {
      "id": "nose",
      "material": "carbon-body",
      "vertices": [
        {
          "x": 0.448,
          "y": -0.29
        },
        {
          "x": 2.744,
          "y": -0.07
        },
        {
          "x": 2.744,
          "y": 0.07
        },
        {
          "x": 0.448,
          "y": 0.29
        }
      ]
    },
    {
      "id": "monocoque",
      "material": "carbon-body",
      "vertices": [
        {
          "x": -1.736,
          "y": -0.49
        },
        {
          "x": -0.448,
          "y": -0.53
        },
        {
          "x": 0.448,
          "y": -0.29
        },
        {
          "x": 0.448,
          "y": 0.29
        },
        {
          "x": -0.448,
          "y": 0.53
        },
        {
          "x": -1.736,
          "y": 0.49
        }
      ]
    },
    {
      "id": "rear-body",
      "material": "carbon-body",
      "vertices": [
        {
          "x": -2.744,
          "y": -0.1
        },
        {
          "x": -1.736,
          "y": -0.49
        },
        {
          "x": -1.736,
          "y": 0.49
        },
        {
          "x": -2.744,
          "y": 0.1
        }
      ]
    },
    {
      "id": "floor-left",
      "material": "carbon-body",
      "vertices": [
        {
          "x": 1.064,
          "y": 0.26
        },
        {
          "x": 0.504,
          "y": 0.62
        },
        {
          "x": -0.168,
          "y": 0.8
        },
        {
          "x": -1.68,
          "y": 0.84
        },
        {
          "x": -2.408,
          "y": 0.64
        },
        {
          "x": -2.632,
          "y": 0.34
        },
        {
          "x": -1.512,
          "y": 0.28
        },
        {
          "x": -0.28,
          "y": 0.25
        }
      ]
    },
    {
      "id": "floor-right",
      "material": "carbon-body",
      "vertices": [
        {
          "x": -0.28,
          "y": -0.25
        },
        {
          "x": -1.512,
          "y": -0.28
        },
        {
          "x": -2.632,
          "y": -0.34
        },
        {
          "x": -2.408,
          "y": -0.64
        },
        {
          "x": -1.68,
          "y": -0.84
        },
        {
          "x": -0.168,
          "y": -0.8
        },
        {
          "x": 0.504,
          "y": -0.62
        },
        {
          "x": 1.064,
          "y": -0.26
        }
      ]
    },
    {
      "id": "front-left-wheel",
      "material": "tyre",
      "vertices": [
        {
          "x": 1.1816,
          "y": 0.64
        },
        {
          "x": 1.8424,
          "y": 0.64
        },
        {
          "x": 1.8424,
          "y": 1
        },
        {
          "x": 1.1816,
          "y": 1
        }
      ]
    },
    {
      "id": "front-right-wheel",
      "material": "tyre",
      "vertices": [
        {
          "x": 1.1816,
          "y": -1
        },
        {
          "x": 1.8424,
          "y": -1
        },
        {
          "x": 1.8424,
          "y": -0.64
        },
        {
          "x": 1.1816,
          "y": -0.64
        }
      ]
    },
    {
      "id": "rear-left-wheel",
      "material": "tyre",
      "vertices": [
        {
          "x": -2.114,
          "y": 0.56
        },
        {
          "x": -1.358,
          "y": 0.56
        },
        {
          "x": -1.358,
          "y": 1
        },
        {
          "x": -2.114,
          "y": 1
        }
      ]
    },
    {
      "id": "rear-right-wheel",
      "material": "tyre",
      "vertices": [
        {
          "x": -2.114,
          "y": -1
        },
        {
          "x": -1.358,
          "y": -1
        },
        {
          "x": -1.358,
          "y": -0.56
        },
        {
          "x": -2.114,
          "y": -0.56
        }
      ]
    },
    {
      "id": "rear-wing-left",
      "material": "rear-wing",
      "vertices": [
        {
          "x": -2.1728,
          "y": 0
        },
        {
          "x": -2.1728,
          "y": 0.2
        },
        {
          "x": -2.268,
          "y": 0.76
        },
        {
          "x": -2.8,
          "y": 0.86
        },
        {
          "x": -2.8,
          "y": 0
        }
      ]
    },
    {
      "id": "rear-wing-right",
      "material": "rear-wing",
      "vertices": [
        {
          "x": -2.8,
          "y": 0
        },
        {
          "x": -2.8,
          "y": -0.86
        },
        {
          "x": -2.268,
          "y": -0.76
        },
        {
          "x": -2.1728,
          "y": -0.2
        },
        {
          "x": -2.1728,
          "y": 0
        }
      ]
    }
  ],
  "visualToleranceMeters": 0.04
}
